{
  "schema_version": "7.0",
  "artifact_type": "kristall_axis_registry",
  "registry_id": "urn:kristall:registry:axes",
  "axes": [
    {
      "axis_id": "KQ2001",
      "axis_type": "orientation",
      "label": "Legal authority",
      "description": "Organizes a subject around legally conferred authority, competence, limits and review.",
      "status": "active",
      "scope": {
        "subject_id": "subject:power-canada-quebec"
      },
      "semantics": {
        "intent": "Prefer legal authority, jurisdiction, delegation, limits and remedies.",
        "signals": [
          "legal_authority",
          "jurisdiction",
          "delegation",
          "judicial_review"
        ],
        "anti_signals": [
          "mere_attention",
          "mere_popularity"
        ]
      },
      "provenance": {
        "mode": "authored",
        "accepted_by": "policy:traceable-promotion"
      }
    },
    {
      "axis_id": "KQ2002",
      "axis_type": "orientation",
      "label": "Informal influence",
      "description": "Organizes the same subject around non-legal leverage, dependency, attention and persuasion.",
      "status": "active",
      "scope": {
        "subject_id": "subject:power-canada-quebec"
      },
      "semantics": {
        "intent": "Prefer influence mechanisms that do not themselves create legal authority.",
        "signals": [
          "financial_dependency",
          "media_attention",
          "lobbying",
          "reputation"
        ],
        "anti_signals": [
          "statutory_competence"
        ]
      },
      "provenance": {
        "mode": "hybrid",
        "crystallization_record_id": "crystallization:001",
        "accepted_by": "policy:traceable-promotion"
      }
    }
  ],
  "namespace_id": "kristall-main"
}
